{
  "schemaVersion": 1,
  "kind": "gpu-report",
  "status": "BLOCKED_EXTERNAL",
  "reasons": [
    "Provide a real trace using --input PATH --sha256 HEX; see the task procedure"
  ],
  "metrics": {},
  "sourceRevision": "8c218aa3e3309a700f47819aaede19f95b507a98",
  "validatorSha256": "5ece308046dcd82ecdf3eed873580051f01a1afa47bdf50d72fc67279e47c268"
}
